category_name,target_percent,notes
Social Security,21,"Pensions, retirement, and related social insurance"
National Defense,18,"Defense spending and military services"
Health,15,"Healthcare expenditures excluding Medicare"
Net Interest,14,"Interest payments on public debt"
Medicare,13,"Public health insurance for seniors"
Income Security,8,"Welfare, unemployment benefits"
Veterans Benefits and Services,5,"Care and benefits for veterans"
Education,Training,Employment,and Social Services,4,"Spending on public education and social services"